<?xml version="1.0" encoding="utf-8"?>
<MissionDataList
        xmlns:xsd="http://www.w3.org/2001/XMLSchema" 
        xmlns:xsi="http://www.w3.org/2001/XMLSchema-instance"                   
        xsi:noNamespaceSchemaLocation="Missions.xsd">
  <Mission>
    <Name>Escort Party</Name>
    <NotorietyCost>5</NotorietyCost>
    <GoldRewardPerClearing>2</GoldRewardPerClearing>
    <PrimaryDestination>Inn</PrimaryDestination>
    <SecondaryDestination>House</SecondaryDestination>
  </Mission>

  <Mission>
    <Name>Food/Ale</Name>
    <NotorietyCost>5</NotorietyCost>
    <GoldRewardPerClearing>2</GoldRewardPerClearing>
    <PrimaryDestination>Chapel</PrimaryDestination>
    <SecondaryDestination>Guardhouse</SecondaryDestination>
  </Mission>
</MissionDataList>
